{
  "contract_id": "moonmold.spatial-operation-receipt.v1",
  "operation_ref": "moonmold/spatial.operation.execute@0.2.0",
  "request_id": "flow-material-24-exec",
  "source_request_id": "material-24",
  "attempt_id": "attempt-material-24-exec",
  "idempotency_key": "material-24/exec",
  "outcome": "applied",
  "before_digest": "mm1-5182072",
  "after_digest": "mm1-3214739",
  "claim_ceiling": "digital-artifact",
  "physical_authority": false,
  "artifacts": [],
  "changed_objects": [
    "primary-mass"
  ],
  "warnings": [
    "deterministic mock output is reference evidence, not Blender evidence"
  ],
  "validation_evidence": {
    "validator": "moonmold-mock-validator",
    "validator_version": "1",
    "subject_digest": "mm1-3214739",
    "accepted": true,
    "findings": []
  },
  "backend_qualification": {
    "selected_backend": "deterministic-mock-reference",
    "evidence_class": "fixture-reference-only",
    "production_qualified": false,
    "blender_evidence": false,
    "physical_authority": false
  },
  "review_required": true,
  "reconciliation": {
    "supported": true,
    "state": "terminal"
  }
}
